{
  "agent_skill_path": "skills/agent/leveraged-etp-risk-lab/SKILL.md",
  "command_map": [
    {
      "example": "python -m leveraged_etp_risk_lab pretrade-plan --product examples/fixtures/leveraged_nasdaq_3x.json --path examples/fixtures/nasdaq_chop_path.csv --thesis-file examples/fixtures/thesis_note.md --max-loss-budget 750 --stop-loss 0.15 --take-profit 0.20 --format markdown",
      "name": "pretrade-plan",
      "purpose": "Build the base thesis, budget, and risk-band packet."
    },
    {
      "example": "python -m leveraged_etp_risk_lab stress-matrix --product examples/fixtures/leveraged_nasdaq_3x.json --stop-loss 0.15 --take-profit 0.20 --format markdown",
      "name": "stress-matrix",
      "purpose": "Run the product across built-in deterministic regimes."
    },
    {
      "example": "python -m leveraged_etp_risk_lab sensitivity-grid --product examples/fixtures/leveraged_nasdaq_3x.json --stop-loss none,0.15,0.25 --take-profit none,0.20,0.35 --format markdown",
      "name": "sensitivity-grid",
      "purpose": "Compare leverage, stop-loss, and take-profit grids."
    },
    {
      "example": "python -m leveraged_etp_risk_lab watchlist-build --thesis-impact examples/outputs/thesis_impact.json --stress-matrix examples/outputs/stress_matrix.json --format markdown",
      "name": "watchlist-build",
      "purpose": "Turn thesis and stress results into review triggers."
    },
    {
      "example": "python -m leveraged_etp_risk_lab package-audit --format markdown",
      "name": "package-audit",
      "purpose": "Check public sharing readiness and validation commands."
    },
    {
      "example": "python -m leveraged_etp_risk_lab recipe-run --recipe examples/fixtures/recipe_thesis_review.json --format markdown",
      "name": "recipe-run",
      "purpose": "Compose the public workflow from one JSON recipe."
    },
    {
      "example": "python -m leveraged_etp_risk_lab report-card --artifact examples/outputs/pretrade_plan.json --artifact examples/outputs/position_size.json --artifact examples/outputs/stress_matrix.json --artifact examples/outputs/factsheet_check.json --format markdown",
      "name": "report-card",
      "purpose": "Summarize artifact strengths, warnings, and unresolved checks."
    },
    {
      "example": "python -m leveraged_etp_risk_lab memo-draft --recipe-run examples/outputs/recipe_run.json --thesis-dashboard-data examples/outputs/thesis_dashboard_data.json --report-card examples/outputs/report_card.json --factsheet-check examples/outputs/factsheet_check.json --format markdown",
      "name": "memo-draft",
      "purpose": "Package thesis, scenario evidence, and risk budget into a memo."
    },
    {
      "example": "python -m leveraged_etp_risk_lab memo-review --memo examples/outputs/investment_memo.json --report-card examples/outputs/report_card.json --watchlist examples/outputs/watchlist.json --audit-trail examples/outputs/audit_trail.json --format markdown",
      "name": "memo-review",
      "purpose": "Compare the memo against latest review artifacts."
    },
    {
      "example": "python -m leveraged_etp_risk_lab cycle-init --memo examples/outputs/investment_memo.json --watchlist examples/outputs/watchlist.json --report-card examples/outputs/report_card.json --sensitivity-grid examples/outputs/sensitivity_grid.json --format markdown",
      "name": "cycle-init",
      "purpose": "Create a persistent public watch-cycle state."
    },
    {
      "example": "python -m leveraged_etp_risk_lab cycle-update --cycle-state examples/outputs/cycle_state.json --report-card examples/outputs/report_card.json --watchlist examples/outputs/watchlist.json --audit-trail examples/outputs/audit_trail.json --format markdown",
      "name": "cycle-update",
      "purpose": "Detect watch-cycle hash drift and watchlist changes."
    },
    {
      "example": "python -m leveraged_etp_risk_lab guardrail-policy --policy default --format markdown",
      "name": "guardrail-policy",
      "purpose": "Emit explicit allocation review limits."
    },
    {
      "example": "python -m leveraged_etp_risk_lab guardrail-check --policy examples/outputs/guardrail_policy.json --portfolio-sensitivity examples/outputs/portfolio_sensitivity.json --position-size examples/outputs/position_size.json --investment-memo examples/outputs/investment_memo.json --cycle-update examples/outputs/cycle_update.json --format markdown",
      "name": "guardrail-check",
      "purpose": "Gate artifacts against exposure, budget, horizon, and review rules."
    },
    {
      "example": "python -m leveraged_etp_risk_lab order-ticket --guardrail-check examples/outputs/guardrail_check.json --investment-memo examples/outputs/investment_memo.json --position-size examples/outputs/position_size.json --factsheet-check examples/outputs/factsheet_check.json --thesis-dashboard-data examples/outputs/thesis_dashboard_data.json --format markdown",
      "name": "order-ticket",
      "purpose": "Create placeholder-only broker field and do-not-trade checklists."
    },
    {
      "example": "python -m leveraged_etp_risk_lab order-review --order-ticket examples/outputs/order_ticket.json --guardrail-check examples/outputs/guardrail_check.json --cycle-update examples/outputs/cycle_update.json --audit-trail examples/outputs/audit_trail.json --format markdown",
      "name": "order-review",
      "purpose": "Run a final educational order review without execution."
    },
    {
      "example": "python -m leveraged_etp_risk_lab demo-story --input-dir examples/outputs --format markdown",
      "name": "demo-story",
      "purpose": "Render the public walkthrough from checked demo artifacts."
    },
    {
      "example": "python -m leveraged_etp_risk_lab scenario-pack --input-dir examples/outputs --fixtures-dir examples/fixtures --output-dir examples/outputs --format markdown",
      "name": "scenario-pack",
      "purpose": "Write new-user case-study packs for path decay, drawdowns, and guardrails."
    },
    {
      "example": "python -m leveraged_etp_risk_lab schema-inventory --format markdown",
      "name": "schema-inventory",
      "purpose": "List local schemas, required fields, matching examples, and public safety notes."
    },
    {
      "example": "python -m leveraged_etp_risk_lab artifact-validate --format markdown",
      "name": "artifact-validate",
      "purpose": "Validate example JSON artifacts against the local lightweight schema inventory."
    },
    {
      "example": "python -m leveraged_etp_risk_lab release-manifest --input-dir examples/outputs --format markdown",
      "name": "release-manifest",
      "purpose": "Emit release readiness, public artifact inventory, and release notes."
    },
    {
      "example": "python -m leveraged_etp_risk_lab docs-export --input-dir examples/outputs --output examples/outputs/docs_export.html",
      "name": "docs-export",
      "purpose": "Render one self-contained static HTML documentation page from public artifacts."
    },
    {
      "example": "python -m leveraged_etp_risk_lab asset-hub --input-dir examples/outputs --format markdown",
      "name": "asset-hub",
      "purpose": "Emit the GitHub-facing public asset hub."
    }
  ],
  "demo_artifact_map": [
    {
      "artifact_count": 21,
      "key_artifacts": [
        "examples/outputs/glossary.json",
        "examples/outputs/glossary.md",
        "examples/outputs/leveraged_nasdaq_3x.json",
        "examples/outputs/leveraged_nasdaq_3x.md",
        "examples/outputs/portfolio_exposure.json",
        "examples/outputs/portfolio_exposure.md"
      ],
      "stage": "fixtures",
      "suggested_next_command": "python -m leveraged_etp_risk_lab pretrade-plan --product examples/fixtures/leveraged_nasdaq_3x.json --path examples/fixtures/nasdaq_chop_path.csv --thesis-file examples/fixtures/thesis_note.md --max-loss-budget 750 --format markdown"
    },
    {
      "artifact_count": 9,
      "key_artifacts": [
        "examples/outputs/compare_runs.json",
        "examples/outputs/compare_runs.md",
        "examples/outputs/pretrade_plan.json",
        "examples/outputs/pretrade_plan.md",
        "examples/outputs/recipe_run.json",
        "examples/outputs/recipe_run.md"
      ],
      "stage": "plans",
      "suggested_next_command": "python -m leveraged_etp_risk_lab position-size --pretrade-plan examples/outputs/pretrade_plan.json --account-value 50000 --risk-budget-pct 0.015 --format markdown"
    },
    {
      "artifact_count": 2,
      "key_artifacts": [
        "examples/outputs/position_size.json",
        "examples/outputs/position_size.md"
      ],
      "stage": "sizing",
      "suggested_next_command": "python -m leveraged_etp_risk_lab stress-matrix --product examples/fixtures/leveraged_nasdaq_3x.json --stop-loss 0.15 --take-profit 0.20 --format markdown"
    },
    {
      "artifact_count": 6,
      "key_artifacts": [
        "examples/outputs/portfolio_sensitivity.json",
        "examples/outputs/portfolio_sensitivity.md",
        "examples/outputs/sensitivity_grid.json",
        "examples/outputs/sensitivity_grid.md",
        "examples/outputs/stress_matrix.json",
        "examples/outputs/stress_matrix.md"
      ],
      "stage": "stress",
      "suggested_next_command": "python -m leveraged_etp_risk_lab thesis-impact --thesis-file examples/fixtures/thesis_note.md --artifact examples/outputs/pretrade_plan.json --artifact examples/outputs/stress_matrix.json --format markdown"
    },
    {
      "artifact_count": 4,
      "key_artifacts": [
        "examples/outputs/thesis_impact.json",
        "examples/outputs/thesis_impact.md",
        "examples/outputs/watchlist.json",
        "examples/outputs/watchlist.md"
      ],
      "stage": "thesis/watchlist",
      "suggested_next_command": "python -m leveraged_etp_risk_lab demo-story --input-dir examples/outputs --format markdown"
    },
    {
      "artifact_count": 18,
      "key_artifacts": [
        "examples/outputs/asset_hub.json",